index_name,alias,unit,viz_type,insights,notes,2005-06,2006-07,2007-08,2008-09,2009-10,2010-11,2011-12,2012-13,2013-14(Prov),2013-14,2014-15,2015-16(Prov),2015-16(RE),2016-17(BE),source
Share of Direct Taxes in Centre's Gross Tax Revenue,,Percentage of Gross Tax Revenue,simple_bar,"The government’s expectation on indirect tax collection is relatively higher compared to direct taxes, provided that indirect taxes are more regressive in nature. In the 2016-17 BE the proportion of direct taxes and indirect taxes is estimated at 52:48 which is less than 2014-15 actual figure of 56:44.",,,,,,60.8,56.5,55.8,54.1,,55.1,55.9,,51.5,52,Compiled by CBGA from Economic Survey 2015-16 and Reserve Bank of India statistics
Share of Indirect Taxes in Centre's Gross Tax Revenue,,Percentage of Gross Tax Revenue,simple_bar,"The government’s expectation on indirect tax collection is relatively higher compared to direct taxes, provided that indirect taxes are more regressive in nature. In the 2016-17 BE the proportion of direct taxes and indirect taxes is estimated at 52:48 which is less than 2014-15 actual figure of 56:44.",,,,,,39.2,43.5,44.2,45.9,,44.9,44.1,,48.5,48.1,Compiled by CBGA from Economic Survey 2015-16 and Reserve Bank of India statistics
Total Revenue Foregone,,Percent of GDP,simple_bar,,,6.6,6.7,6.8,8.1,7.4,5.9,5.9,5.5,,4.7,4.3,4.4,,,
Total Tax Revenue,,Rs crore,simple_bar,,,270264,351182,439547,443319,456536,569869,629765,741877,836026,,,,,,
Revenue foregone as a % of Tax Revenue,,Percentage of Tax Revenue,simple_bar,,,89.8,82.3,77.7,103.4,105.7,80.7,84.7,76.3,68.5,,,,,,
