index_name,unit,2012-13,2013-14,2014-15 ,2015-16(RE),2016-17(BE),notes,insights
Internal & Extra Budgetray Resources (IEBR),Rs crore,1894,2966,3291,5431,9193,,There is increase in IEBR for MNRE to Rs. 9193 crore  in 2016-17 (RE) in comparision to Rs.5431crore in 2015-16 (RE). Major allocation from IEBR is made to Indian Renewable Energy Development Authority (IREDA) of Rs. 9119 crore.
Gross Budgetary Support (GBS),Rs crore,1089,383,502,246.53,5000,,There is 20 times increase in Gross Budgetray Support for MNRE in 2016-17 (BE) of Rs. 5000 crore in comparision to 2015-16 (RE) of Rs. 247 crore. However, this allocation may not be matching with finance requirement arised after the last year revision in target of Renewable Energy to 175 GW.
Grid interactive Renewable Power (RP),Rs crore,874,1133,1845,3894,3519,Above figures includes funds made available from National Clean Energy Funds,There is slight decrease in allocation for the scheme of Grid Interactive Renewable Power. The restructured scheme have considered capacity addition for transmission and distribution of renewable energy which is a welcome step.
Off Grid / Distributed and Decentralised Renewable Power,Rs crore,131.7,119,160,97.18,983,Above figures includes funds made available from National Clean Energy Funds,There is a visible increase in allocation for the Scheme of Off Grid / Distributed and Decentralised Renewable Power with allocation of Rs. 983 crore in 2016-17 (BE) in comparison to Rs. 97 crore in 2015-16 (RE).
"Research,Development & International Cooperation",Rs crore,100.23,137,127,106,445,Above figures includes funds made available from National Clean Energy Funds,"There is quantum increaseof 5 folds in budget allocation for Research,Design and Development in Renewable Energy in Budget 2016-17 in comprision to previous year."
